{"access":{"class":"public","export_policy":"full","owner_project":null,"permitted_principals":[]},"aliases":[{"type":"preferred_name","value":"Fixture literature-reported protocol"}],"applicability":{"catalyst_classes":["synthetic boron fixture"],"exclusions":["transition metals","open-shell states"],"included_elements":["B","C","H"],"job_stages":["optimization","frequency"],"limitations":["Reported use is not evidence of accuracy or transferability."],"reaction_classes":["offline validation fixture"],"state_types":["neutral closed-shell singlet"]},"blockers":[],"calculation_ready":false,"contradictions":[],"created_at":"2026-07-15T00:00:00+00:00","created_by":"fixture_author","evidence":{"benchmark_record_refs":[],"failure_record_refs":[],"notes":["This record is literature-reported, not group recommended or benchmark validated."],"resource_observations":[],"supporting_source_refs":[{"payload_sha256":"f2f0e6ab8605b1174026a008fb8291bd881d3254730b1f0381775bbe52d4fd15","record_id":"fixture_article","record_type":"source","revision_id":"fixture_article_r001"}]},"external_identifiers":[],"no_submission_authorization":true,"payload_sha256":"af656c1e93130638d22d848acdfd8d1a36aa4904dea382514a847721029f964d","protocol":{"basis_by_element":{"notes":[],"source_anchor_refs":[{"anchor_id":"fixture_method_anchor","source_record":{"payload_sha256":"f2f0e6ab8605b1174026a008fb8291bd881d3254730b1f0381775bbe52d4fd15","record_id":"fixture_article","record_type":"source","revision_id":"fixture_article_r001"}}],"status":"reported","value":{"B,C,H":"6-31G(d)"}},"calculation_family":{"notes":[],"source_anchor_refs":[{"anchor_id":"fixture_method_anchor","source_record":{"payload_sha256":"f2f0e6ab8605b1174026a008fb8291bd881d3254730b1f0381775bbe52d4fd15","record_id":"fixture_article","record_type":"source","revision_id":"fixture_article_r001"}}],"status":"reported","value":"minimum optimization and harmonic frequency"},"charge_spin_requirements":{"notes":[],"source_anchor_refs":[{"anchor_id":"fixture_method_anchor","source_record":{"payload_sha256":"f2f0e6ab8605b1174026a008fb8291bd881d3254730b1f0381775bbe52d4fd15","record_id":"fixture_article","record_type":"source","revision_id":"fixture_article_r001"}}],"status":"reported","value":"neutral closed-shell singlet"},"dispersion":{"notes":[],"source_anchor_refs":[{"anchor_id":"fixture_method_anchor","source_record":{"payload_sha256":"f2f0e6ab8605b1174026a008fb8291bd881d3254730b1f0381775bbe52d4fd15","record_id":"fixture_article","record_type":"source","revision_id":"fixture_article_r001"}}],"status":"reported","value":"GD3BJ"},"ecp_by_element":{"notes":[],"source_anchor_refs":[],"status":"not_applicable","value":null},"explicit_components":{"notes":[],"source_anchor_refs":[],"status":"not_applicable","value":null},"frequency_policy":{"notes":[],"source_anchor_refs":[{"anchor_id":"fixture_method_anchor","source_record":{"payload_sha256":"f2f0e6ab8605b1174026a008fb8291bd881d3254730b1f0381775bbe52d4fd15","record_id":"fixture_article","record_type":"source","revision_id":"fixture_article_r001"}}],"status":"reported","value":"harmonic frequency at optimization level"},"functional":{"notes":[],"source_anchor_refs":[{"anchor_id":"fixture_method_anchor","source_record":{"payload_sha256":"f2f0e6ab8605b1174026a008fb8291bd881d3254730b1f0381775bbe52d4fd15","record_id":"fixture_article","record_type":"source","revision_id":"fixture_article_r001"}}],"status":"reported","value":"B3LYP"},"integration_grid":{"notes":[],"source_anchor_refs":[{"anchor_id":"fixture_method_anchor","source_record":{"payload_sha256":"f2f0e6ab8605b1174026a008fb8291bd881d3254730b1f0381775bbe52d4fd15","record_id":"fixture_article","record_type":"source","revision_id":"fixture_article_r001"}}],"status":"reported","value":"ultrafine"},"irc_policy":{"notes":[],"source_anchor_refs":[],"status":"not_applicable","value":null},"low_frequency_entropy":{"notes":[],"source_anchor_refs":[{"anchor_id":"fixture_method_anchor","source_record":{"payload_sha256":"f2f0e6ab8605b1174026a008fb8291bd881d3254730b1f0381775bbe52d4fd15","record_id":"fixture_article","record_type":"source","revision_id":"fixture_article_r001"}}],"status":"reported","value":"no low-frequency correction reported"},"optimization_policy":{"notes":[],"source_anchor_refs":[{"anchor_id":"fixture_method_anchor","source_record":{"payload_sha256":"f2f0e6ab8605b1174026a008fb8291bd881d3254730b1f0381775bbe52d4fd15","record_id":"fixture_article","record_type":"source","revision_id":"fixture_article_r001"}}],"status":"reported","value":"tight optimization"},"program":{"notes":[],"source_anchor_refs":[{"anchor_id":"fixture_method_anchor","source_record":{"payload_sha256":"f2f0e6ab8605b1174026a008fb8291bd881d3254730b1f0381775bbe52d4fd15","record_id":"fixture_article","record_type":"source","revision_id":"fixture_article_r001"}}],"status":"reported","value":"Gaussian"},"program_revision":{"notes":[],"source_anchor_refs":[{"anchor_id":"fixture_method_anchor","source_record":{"payload_sha256":"f2f0e6ab8605b1174026a008fb8291bd881d3254730b1f0381775bbe52d4fd15","record_id":"fixture_article","record_type":"source","revision_id":"fixture_article_r001"}}],"status":"reported","value":"Gaussian 16 Revision C.01"},"relativistic_treatment":{"notes":[],"source_anchor_refs":[],"status":"not_applicable","value":null},"scf_policy":{"notes":[],"source_anchor_refs":[{"anchor_id":"fixture_method_anchor","source_record":{"payload_sha256":"f2f0e6ab8605b1174026a008fb8291bd881d3254730b1f0381775bbe52d4fd15","record_id":"fixture_article","record_type":"source","revision_id":"fixture_article_r001"}}],"status":"reported","value":"tight convergence"},"single_point_relationship":{"notes":[],"source_anchor_refs":[],"status":"not_applicable","value":null},"solvent_model":{"notes":[],"source_anchor_refs":[{"anchor_id":"fixture_method_anchor","source_record":{"payload_sha256":"f2f0e6ab8605b1174026a008fb8291bd881d3254730b1f0381775bbe52d4fd15","record_id":"fixture_article","record_type":"source","revision_id":"fixture_article_r001"}}],"status":"reported","value":"SMD(toluene)"},"stability_checks":{"notes":[],"source_anchor_refs":[{"anchor_id":"fixture_method_anchor","source_record":{"payload_sha256":"f2f0e6ab8605b1174026a008fb8291bd881d3254730b1f0381775bbe52d4fd15","record_id":"fixture_article","record_type":"source","revision_id":"fixture_article_r001"}}],"status":"reported","value":"no separate stability check reported"},"standard_state_concentration":{"notes":[],"source_anchor_refs":[{"anchor_id":"fixture_method_anchor","source_record":{"payload_sha256":"f2f0e6ab8605b1174026a008fb8291bd881d3254730b1f0381775bbe52d4fd15","record_id":"fixture_article","record_type":"source","revision_id":"fixture_article_r001"}}],"status":"reported","value":"1 atm; no solution concentration correction reported"},"temperature_pressure":{"notes":[],"source_anchor_refs":[{"anchor_id":"fixture_method_anchor","source_record":{"payload_sha256":"f2f0e6ab8605b1174026a008fb8291bd881d3254730b1f0381775bbe52d4fd15","record_id":"fixture_article","record_type":"source","revision_id":"fixture_article_r001"}}],"status":"reported","value":{"pressure_atm":1.0,"temperature_k":298.15}},"ts_policy":{"notes":[],"source_anchor_refs":[],"status":"not_applicable","value":null},"wavefunction_policy":{"notes":[],"source_anchor_refs":[{"anchor_id":"fixture_method_anchor","source_record":{"payload_sha256":"f2f0e6ab8605b1174026a008fb8291bd881d3254730b1f0381775bbe52d4fd15","record_id":"fixture_article","record_type":"source","revision_id":"fixture_article_r001"}}],"status":"reported","value":"restricted Kohn-Sham"}},"provenance":{"importer":null,"source_artifacts":[],"source_kind":"manual_review"},"record_id":"fixture_reported_method","review":{"notes":["Reported protocol fixture; not a group recommendation."],"reviewed_at":"2026-07-15T01:00:00+00:00","reviewer":"fixture_reviewer","status":"reviewed"},"revision_id":"fixture_reported_method_r001","schema":"auto-g16-method-record/1","source_class":"literature_reported","uncertainties":[]}
